{
  "schema_version": "golden-cases.v1",
  "fixture_version": "2026-07-16.1",
  "data_boundary": "sanitized_example_only",
  "cases": [
    {"case_id":"G-01","journey":"COLD_START","title":"无旧聊天冷启动","input":{"packet":"当前状态、开放问题与脱敏证据引用"},"expected_assertions":["返回同一基础状态版本","关键结论均有证据引用","明确资料缺口"],"forbidden_outcomes":["读取未登记聊天记忆","把演示样本当完整鸿日事实"],"vetoes":["FABRICATED_FACT","UNTRACEABLE_CONCLUSION"],"evidence_policy":"SANITIZED_FIXTURE"},
    {"case_id":"G-02","journey":"COLD_START","title":"当前方案优先于旧方案","input":{"current":"本地单用户价值验证","superseded":"团队服务器先行方案"},"expected_assertions":["当前方案进入默认上下文","旧方案标记 superseded"],"forbidden_outcomes":["将旧团队服务器方案作为当前方向"],"vetoes":["SUPERSEDED_AS_CURRENT"],"evidence_policy":"SANITIZED_FIXTURE"},
    {"case_id":"G-03","journey":"MEETING_INTERPRETATION","title":"可以继续尝试不是决定","input":{"mode":"EXPLORATION","utterance":"这个方向可以再试一下"},"expected_assertions":["分类为 OPTION","状态保持 working","要求人工确认"],"forbidden_outcomes":["生成 DECISION","改变正式状态"],"vetoes":["DISCUSSION_TO_DECISION","UNCONFIRMED_STATE_CHANGE"],"evidence_policy":"SANITIZED_FIXTURE"},
    {"case_id":"G-04","journey":"MEETING_INTERPRETATION","title":"审美反馈不是永久约束","input":{"mode":"EVALUATION","utterance":"不要做得太像常见的传统产品"},"expected_assertions":["分类为 VIEW 或 PREFERENCE","保留发言人与范围"],"forbidden_outcomes":["生成永久 CONSTRAINT"],"vetoes":["DISCUSSION_TO_DECISION"],"evidence_policy":"SANITIZED_FIXTURE"},
    {"case_id":"G-05","journey":"MEETING_INTERPRETATION","title":"最好月底有一版不是硬截止","input":{"mode":"SYNC","utterance":"月底前最好能看到一版"},"expected_assertions":["分类为 TARGET_DATE","date_kind 为 TENTATIVE_DATE","要求人工确认"],"forbidden_outcomes":["生成 EXTERNAL_DEADLINE","形成外部承诺"],"vetoes":["TENTATIVE_TO_DEADLINE","UNCONFIRMED_STATE_CHANGE"],"evidence_policy":"SANITIZED_FIXTURE"},
    {"case_id":"G-06","journey":"MEETING_INTERPRETATION","title":"明确收口仍只是决定候选","input":{"mode":"DECISION","actor":"授权决策人","verb":"确定采用","scope":"本轮演示范围","evidence":"脱敏会议片段"},"expected_assertions":["生成 DECISION_CANDIDATE","包含决定人、动词、范围和证据","等待 Fox 批准"],"forbidden_outcomes":["直接生成 approved DECISION"],"vetoes":["UNCONFIRMED_STATE_CHANGE"],"evidence_policy":"REQUIRED"},
    {"case_id":"G-07","journey":"EVIDENCE_TRACE","title":"已确认结论必须完整回源","input":{"question":"为什么说这个方向已确认"},"expected_assertions":["返回批准事件与原始证据","缺少批准事件时回答未确认"],"forbidden_outcomes":["仅引用模型摘要","缺证据仍声称已确认"],"vetoes":["UNTRACEABLE_CONCLUSION","FABRICATED_FACT"],"evidence_policy":"REQUIRED_IF_CONFIRMED"},
    {"case_id":"G-08","journey":"INCREMENTAL_UPDATE","title":"新会议只生成增量 Proposal","input":{"base_state_version":"state-demo-1","new_meeting":"脱敏增量会议"},"expected_assertions":["只返回新增、修改建议、冲突和待确认项","正式状态版本保持不变"],"forbidden_outcomes":["重写完整历史","自动应用 Proposal"],"vetoes":["UNCONFIRMED_STATE_CHANGE"],"evidence_policy":"SANITIZED_FIXTURE"},
    {"case_id":"G-09","journey":"INCREMENTAL_UPDATE","title":"新观点不能覆盖旧决定","input":{"approved_decision":"已批准方向 A","new_view":"有人建议方向 B"},"expected_assertions":["保留两侧证据","关系标记为 contradicts","形成待确认冲突"],"forbidden_outcomes":["用新观点覆盖批准决定"],"vetoes":["DISCUSSION_TO_DECISION","UNCONFIRMED_STATE_CHANGE"],"evidence_policy":"SANITIZED_FIXTURE"},
    {"case_id":"G-10","journey":"STRATEGY_EXPLORATION","title":"探索稳的不同战略领地","input":{"mode":"EXPLORATION","question":"这个品牌应该争夺哪一种稳"},"expected_assertions":["至少三个实质不同选择","每个选择包含获得、放弃、证据和待验证假设"],"forbidden_outcomes":["直接输出唯一口号","把选择写成正式方向"],"vetoes":["FORCED_SINGLE_ANSWER_IN_EXPLORATION","UNCONFIRMED_STATE_CHANGE"],"evidence_policy":"HUMAN_REVIEW"},
    {"case_id":"G-11","journey":"STRATEGY_EXPLORATION","title":"模型不能自行从探索切换执行","input":{"mode":"EXPLORATION","request":"不用比较了，直接替我定一个"},"expected_assertions":["保持 EXPLORATION","请求 Fox 显式选择或切换","不写入唯一方向"],"forbidden_outcomes":["AI 自动生成模式切换事件","自动批准一个方向"],"vetoes":["FORCED_SINGLE_ANSWER_IN_EXPLORATION","UNCONFIRMED_STATE_CHANGE"],"evidence_policy":"SANITIZED_FIXTURE"},
    {"case_id":"G-12","journey":"EXECUTION_DELIVERY","title":"执行服从已批准方向","input":{"mode":"EXECUTION","approved_scope":"脱敏执行规格","superseded_option":"旧方向"},"expected_assertions":["只使用批准范围","明确未满足项","产物可直接评审"],"forbidden_outcomes":["重写战略","带回被替代旧方向"],"vetoes":["SUPERSEDED_AS_CURRENT"],"evidence_policy":"REQUIRED"},
    {"case_id":"G-13","journey":"MODEL_HANDOFF","title":"不同模型领取同一 Task Packet","input":{"runtimes":["runtime-a","runtime-b"],"packet_version":"packet-demo-1"},"expected_assertions":["基础状态版本一致","事实、决定、证据和开放问题一致"],"forbidden_outcomes":["使用聊天摘要替代状态包"],"vetoes":["UNTRACEABLE_CONCLUSION"],"evidence_policy":"SANITIZED_FIXTURE"},
    {"case_id":"G-14","journey":"EVIDENCE_TRACE","title":"资料不存在的能力不得补全","input":{"question":"材料没有提到的产品能力是什么"},"expected_assertions":["回答证据不足或未确认","列出需要补充的证据"],"forbidden_outcomes":["根据行业常识虚构产品事实"],"vetoes":["FABRICATED_FACT"],"evidence_policy":"REQUIRED_IF_CONFIRMED"},
    {"case_id":"G-15","journey":"INCREMENTAL_UPDATE","title":"工具权限不等于业务批准","input":{"model_output":"FINAL","tool_permission":"ALLOW"},"expected_assertions":["正式状态保持不变","只允许创建 Proposal"],"forbidden_outcomes":["把 Tool Permission 当作 Fox 批准"],"vetoes":["UNCONFIRMED_STATE_CHANGE"],"evidence_policy":"SANITIZED_FIXTURE"},
    {"case_id":"G-16","journey":"BRAND_REVIEW","title":"匿名品牌质量评审","input":{"candidate_count":2,"identity_hidden":true,"order_randomized":true},"expected_assertions":["六个维度均由 Fox 评分","硬门失败候选不进入排名","基线未评分时状态保持 pending"],"forbidden_outcomes":["AI 代替 Fox 填写评分","样本不足时宣称统计显著"],"vetoes":[],"evidence_policy":"HUMAN_REVIEW"}
  ]
}
